{
  "trace_id": "trace_ea8413a0-67e0-4207-9435-31ca6cad23af",
  "node_id": "DEC-002",
  "input": {
    "task_id": "task_8c181221-7f87-4d4b-b61d-b33e093e5c3b",
    "route": {
      "route_status": "routed",
      "mode": "create_from_materials",
      "routing_reason": "User intent selected create_from_materials. Content sources do not override its protection policy.",
      "protection_policy_id": "preserve_material_facts_and_sources",
      "decision_id": "DEC-001",
      "trace": {
        "candidate_modes": [
          "create_from_materials"
        ],
        "selection_basis": "User intent selected create_from_materials. Content sources do not override its protection policy.",
        "conflict_summary": "",
        "trace_id": "trace_ea8413a0-67e0-4207-9435-31ca6cad23af",
        "negated_signals": [],
        "executable": true,
        "fallback": "No alternate mode substitution; clarify scope or expose missing implementation."
      }
    },
    "sources": [
      {
        "source_id": "source_ed43fa97-765c-4b03-9c89-54f288054168",
        "kind": "pdf",
        "locator": "/runtime/runs/39a2dbf3-c19b-4da2-99a6-27fe7b82ef7a/render/deck.pdf",
        "metadata": {
          "source_role": "fact"
        }
      }
    ],
    "constraints": {
      "hard": [],
      "soft": [],
      "defaults": [],
      "conflicts": []
    },
    "style": null,
    "template_ref": null,
    "output": {
      "formats": [
        "pptx",
        "pdf",
        "png"
      ]
    },
    "providers": {
      "text": {
        "provider": "deepseek",
        "model": "deepseek-flash",
        "api_key_env": "DEEPSEEK_API_KEY",
        "parameters": {
          "temperature": 0.2,
          "max_tokens": 12000,
          "timeout_seconds": 180
        }
      }
    },
    "runtime_preferences": {
      "page_count": 6
    },
    "raw_request": {
      "request": {
        "raw_text": "根据已提供的六页虚构软件验证PDF新建中文摘要演示，保留所有原数字、单位、限定与明确流程关系；每个事实保留来源页码。表格行列如不确定须显式报告，不猜测图片内事实或新因果。",
        "attachments": [],
        "requested_mode": "create_from_materials",
        "requested_outputs": [
          "pptx",
          "pdf",
          "png"
        ]
      },
      "attachment_roles": []
    }
  },
  "candidates": [
    {
      "node_id": "DEC-002",
      "candidate_id": "candidate_ede8c7a7-c774-4e05-a670-f76268b61338",
      "value": {
        "field": "page_count",
        "value": 6,
        "level": "soft"
      },
      "score": 0.7,
      "reasons": [
        {
          "source": "runtime_preferences.page_count",
          "kind": "soft"
        }
      ],
      "evidence_refs": [
        "runtime_preferences.page_count"
      ],
      "constraints": [
        {
          "known_field": true,
          "current_execution_supported": true
        },
        {
          "selected": true,
          "handling": "hard > soft > caller default > system default; equal-precedence disagreement blocks"
        }
      ]
    },
    {
      "node_id": "DEC-002",
      "candidate_id": "candidate_07da3e78-57a1-4d05-9d03-ee404e0a2d5a",
      "value": {
        "field": "output_formats",
        "value": [
          "pdf",
          "png",
          "pptx"
        ],
        "level": "hard"
      },
      "score": 1.0,
      "reasons": [
        {
          "source": "TaskSpec.output.formats",
          "kind": "hard"
        }
      ],
      "evidence_refs": [
        "TaskSpec.output.formats"
      ],
      "constraints": [
        {
          "known_field": true,
          "current_execution_supported": true
        },
        {
          "selected": true,
          "handling": "hard > soft > caller default > system default; equal-precedence disagreement blocks"
        }
      ]
    },
    {
      "node_id": "DEC-002",
      "candidate_id": "candidate_9ba322ce-d4a9-497a-8c07-56d14400d030",
      "value": {
        "field": "requested_output_requirements",
        "value": [
          "pdf",
          "png",
          "pptx"
        ],
        "level": "hard"
      },
      "score": 1.0,
      "reasons": [
        {
          "source": "raw_request.request.requested_outputs",
          "kind": "hard"
        }
      ],
      "evidence_refs": [
        "raw_request.request.requested_outputs"
      ],
      "constraints": [
        {
          "known_field": false,
          "current_execution_supported": false
        },
        {
          "semantics": "required inclusion in selected output formats; additional QA intermediates may be retained"
        }
      ]
    },
    {
      "node_id": "DEC-002",
      "candidate_id": "candidate_7d9ec53a-d2f6-44af-8dff-0272e81fe872",
      "value": {
        "field": "page_count",
        "value": 10,
        "level": "default"
      },
      "score": 0.2,
      "reasons": [
        {
          "source": "system_default.page_count",
          "kind": "default"
        }
      ],
      "evidence_refs": [
        "system_default.page_count"
      ],
      "constraints": [
        {
          "known_field": true,
          "current_execution_supported": true
        },
        {
          "selected": false,
          "handling": "hard > soft > caller default > system default; equal-precedence disagreement blocks"
        }
      ]
    },
    {
      "node_id": "DEC-002",
      "candidate_id": "candidate_af181b5f-9fcc-4e5c-acc6-8752c4beb1aa",
      "value": {
        "field": "language",
        "value": "zh-CN",
        "level": "default"
      },
      "score": 0.2,
      "reasons": [
        {
          "source": "system_default.language",
          "kind": "default"
        }
      ],
      "evidence_refs": [
        "system_default.language"
      ],
      "constraints": [
        {
          "known_field": true,
          "current_execution_supported": true
        },
        {
          "selected": true,
          "handling": "hard > soft > caller default > system default; equal-precedence disagreement blocks"
        }
      ]
    },
    {
      "node_id": "DEC-002",
      "candidate_id": "candidate_b34cdbcc-8a2e-49d3-87e1-2192255a24b5",
      "value": {
        "field": "aspect_ratio",
        "value": "16:9",
        "level": "default"
      },
      "score": 0.2,
      "reasons": [
        {
          "source": "system_default.aspect_ratio",
          "kind": "default"
        }
      ],
      "evidence_refs": [
        "system_default.aspect_ratio"
      ],
      "constraints": [
        {
          "known_field": true,
          "current_execution_supported": true
        },
        {
          "selected": true,
          "handling": "hard > soft > caller default > system default; equal-precedence disagreement blocks"
        }
      ]
    },
    {
      "node_id": "DEC-002",
      "candidate_id": "candidate_83529bc9-6d4d-48ee-94f7-c0e11e892d7a",
      "value": {
        "field": "minimum_font_size",
        "value": 16,
        "level": "default"
      },
      "score": 0.2,
      "reasons": [
        {
          "source": "system_default.minimum_font_size",
          "kind": "default"
        }
      ],
      "evidence_refs": [
        "system_default.minimum_font_size"
      ],
      "constraints": [
        {
          "known_field": true,
          "current_execution_supported": true
        },
        {
          "selected": true,
          "handling": "hard > soft > caller default > system default; equal-precedence disagreement blocks"
        }
      ]
    },
    {
      "node_id": "DEC-002",
      "candidate_id": "candidate_7c1bdfe1-40c9-40fb-bd98-2e5a3bfdc883",
      "value": {
        "field": "template",
        "value": null,
        "level": "default"
      },
      "score": 0.2,
      "reasons": [
        {
          "source": "system_default.template",
          "kind": "default"
        }
      ],
      "evidence_refs": [
        "system_default.template"
      ],
      "constraints": [
        {
          "known_field": true,
          "current_execution_supported": true
        },
        {
          "selected": true,
          "handling": "hard > soft > caller default > system default; equal-precedence disagreement blocks"
        }
      ]
    },
    {
      "node_id": "DEC-002",
      "candidate_id": "candidate_4d7b694c-c877-488e-a308-078c645694ec",
      "value": {
        "field": "brand",
        "value": null,
        "level": "default"
      },
      "score": 0.2,
      "reasons": [
        {
          "source": "system_default.brand",
          "kind": "default"
        }
      ],
      "evidence_refs": [
        "system_default.brand"
      ],
      "constraints": [
        {
          "known_field": true,
          "current_execution_supported": true
        },
        {
          "selected": true,
          "handling": "hard > soft > caller default > system default; equal-precedence disagreement blocks"
        }
      ]
    },
    {
      "node_id": "DEC-002",
      "candidate_id": "candidate_bef22034-9d09-4845-9df5-b19389923372",
      "value": {
        "field": "output_formats",
        "value": [
          "pdf",
          "png",
          "pptx"
        ],
        "level": "default"
      },
      "score": 0.2,
      "reasons": [
        {
          "source": "system_default.output_formats",
          "kind": "default"
        }
      ],
      "evidence_refs": [
        "system_default.output_formats"
      ],
      "constraints": [
        {
          "known_field": true,
          "current_execution_supported": true
        },
        {
          "selected": false,
          "handling": "hard > soft > caller default > system default; equal-precedence disagreement blocks"
        }
      ]
    },
    {
      "node_id": "DEC-002",
      "candidate_id": "candidate_6f30e707-df1a-44b8-bd08-1aa9b7062980",
      "value": {
        "field": "audience",
        "value": null,
        "level": "default"
      },
      "score": 0.2,
      "reasons": [
        {
          "source": "system_default.audience",
          "kind": "default"
        }
      ],